{
  "$schema": "https://logos.co/schemas/basecamp-theme/1.json",
  "formatVersion": 1,
  "id": "logos.light",
  "name": "Logos Light",
  "author": "Logos",
  "mode": "light",
  "palette": {
    "background": "#FAFAFA",
    "backgroundSecondary": "#F2F2F2",
    "backgroundTertiary": "#F5F5F5",
    "backgroundElevated": "#FFFFFF",
    "backgroundMuted": "#00000008",
    "backgroundBlack": "#E8E8E8",
    "backgroundInset": "#EDEDED",
    "backgroundButton": "#E6E6E6",
    "surface": "#FFFFFF",
    "surfaceRaised": "#F7F7F7",
    "surfaceInteractiveHover": "#EBEBEB",
    "surfaceRecessed": "#F0F0F0",
    "surfaceContrast": "#D9D9D9",
    "text": "#171717",
    "textSecondary": "#525252",
    "textSubtle": "#5C5C5C",
    "textTertiary": "#6B6B6B",
    "textPlaceholder": "#8A8F99",
    "textMuted": "#A3A3A3",
    "border": "#D4D4D4",
    "borderSecondary": "#E0E3E8",
    "borderTertiary": "#A3A3A3",
    "borderSubtle": "#E5E5E5",
    "borderHairline": "#00000014",
    "borderGlyph": "#0000002E",
    "borderInteractive": "#C7C7C7",
    "borderDark": "#BDBDBD",
    "borderStrong": "#8F8F8F",
    "primary": "#C9512C",
    "primaryHover": "#B34522",
    "primaryPressed": "#8F3C03",
    "primarySoft": "#FCE3D8",
    "primaryForeground": "#FFFFFF",
    "success": "#15803D",
    "successHover": "#16A34A",
    "successPressed": "#166534",
    "successBorder": "#15803D66",
    "error": "#DC2626",
    "errorHover": "#EF4444",
    "errorPressed": "#B91C1C",
    "errorBorder": "#DC262666",
    "warning": "#D97706",
    "warningHover": "#B45309",
    "warningBorder": "#D9770666",
    "info": "#2563EB",
    "notification": "#DC2626",
    "brandMark": "#171717",
    "accentForeground": "#FFFFFF",
    "accentOrange": "#C9512C",
    "accentOrangeMid": "#E0603A",
    "accentOrangeDeep": "#D9431A",
    "accentBurntOrange": "#9A3F05",
    "accentYellowSoft": "#9A8B00",
    "hover": "#E5E5E5",
    "pressed": "#D9D9D9",
    "disabled": "#B3B3B3",
    "focus": "#E07000",
    "glassOverlay": "#0000000A",
    "glassStrong": "#0000001F",
    "overlayDark": "#0000001A",
    "overlayLight": "#FFFFFF99",
    "overlayOrange": "#E0700033",
    "scrim": "#00000066"
  }
}
