{
  "$schema": "https://logos.co/schemas/basecamp-theme/1.json",
  "formatVersion": 1,
  "id": "alisher.paper-serif",
  "name": "Paper Serif",
  "author": "Alisher",
  "mode": "light",
  "palette": {
    "background": "#FAF7F2",
    "backgroundSecondary": "#F3EEE6",
    "backgroundTertiary": "#F6F2EB",
    "backgroundElevated": "#FFFDF9",
    "backgroundMuted": "#3C28140A",
    "backgroundBlack": "#EAE3D8",
    "backgroundInset": "#EEE8DE",
    "backgroundButton": "#E8E1D6",
    "surface": "#FFFDF9",
    "surfaceRaised": "#F8F4EE",
    "surfaceInteractiveHover": "#EDE6DB",
    "surfaceRecessed": "#F2ECE3",
    "surfaceContrast": "#DDD5C8",
    "text": "#1F1A15",
    "textSecondary": "#57504A",
    "textSubtle": "#615952",
    "textTertiary": "#6F675F",
    "textPlaceholder": "#918A82",
    "textMuted": "#A89F95",
    "border": "#DDD5C9",
    "borderSecondary": "#E6DFD4",
    "borderTertiary": "#A9A094",
    "borderSubtle": "#E9E2D8",
    "borderHairline": "#3C281414",
    "borderGlyph": "#3C28142E",
    "borderInteractive": "#CFC6B9",
    "borderDark": "#C2B9AC",
    "borderStrong": "#948B7F",
    "primary": "#C9512C",
    "primaryHover": "#B34522",
    "primaryPressed": "#8F3C03",
    "primarySoft": "#F8E1D3",
    "primaryForeground": "#FFFDF9",
    "success": "#15803D",
    "successHover": "#16A34A",
    "successPressed": "#166534",
    "successBorder": "#15803D66",
    "error": "#DC2626",
    "errorHover": "#EF4444",
    "errorPressed": "#B91C1C",
    "errorBorder": "#DC262666",
    "warning": "#D97706",
    "warningHover": "#B45309",
    "warningBorder": "#D9770666",
    "info": "#2563EB",
    "notification": "#DC2626",
    "brandMark": "#1F1A15",
    "accentForeground": "#FFFDF9",
    "accentOrange": "#C9512C",
    "accentOrangeMid": "#E0603A",
    "accentOrangeDeep": "#D9431A",
    "accentBurntOrange": "#9A3F05",
    "accentYellowSoft": "#9A8B00",
    "hover": "#EAE3D8",
    "pressed": "#DED6CA",
    "disabled": "#B8AFA3",
    "focus": "#E07000",
    "glassOverlay": "#3C28140A",
    "glassStrong": "#3C28141F",
    "overlayDark": "#3C28141A",
    "overlayLight": "#FFFDF999",
    "overlayOrange": "#E0700033",
    "scrim": "#1F1A1566"
  },
  "typography": {
    "family": "Noto Serif"
  }
}
