{
  "$schema": "https://logos.co/schemas/basecamp-theme/1.json",
  "formatVersion": 1,
  "id": "catppuccin.mocha",
  "name": "Catppuccin Mocha",
  "author": "Catppuccin (port)",
  "mode": "dark",
  "palette": {
    "background": "#1E1E2E",
    "backgroundSecondary": "#181825",
    "backgroundTertiary": "#181825",
    "backgroundElevated": "#11111B",
    "backgroundMuted": "#6C70861F",
    "backgroundBlack": "#11111B",
    "backgroundInset": "#11111B",
    "backgroundButton": "#313244",
    "surface": "#313244",
    "surfaceRaised": "#181825",
    "surfaceInteractiveHover": "#45475A",
    "surfaceRecessed": "#11111B",
    "surfaceContrast": "#585B70",

    "text": "#CDD6F4",
    "textSecondary": "#A6ADC8",
    "textSubtle": "#BAC2DE",
    "textTertiary": "#9399B2",
    "textPlaceholder": "#7F849C",
    "textMuted": "#6C7086",

    "border": "#45475A",
    "borderSecondary": "#313244",
    "borderTertiary": "#6C7086",
    "borderSubtle": "#313244",
    "borderHairline": "#6C708633",
    "borderGlyph": "#9399B259",
    "borderInteractive": "#45475A",
    "borderDark": "#313244",
    "borderStrong": "#585B70",

    "primary": "#CBA6F7",
    "primaryHover": "#B4BEFE",
    "primaryPressed": "#A88BE0",
    "primarySoft": "#CBA6F733",
    "primaryForeground": "#11111B",

    "success": "#A6E3A1",
    "successHover": "#94E2D5",
    "successPressed": "#7EC77A",
    "successBorder": "#A6E3A166",
    "error": "#F38BA8",
    "errorHover": "#EBA0AC",
    "errorPressed": "#E06C8C",
    "errorBorder": "#F38BA866",
    "warning": "#F9E2AF",
    "warningHover": "#FAB387",
    "warningBorder": "#F9E2AF66",
    "info": "#89B4FA",
    "notification": "#F38BA8",

    "brandMark": "#CDD6F4",
    "accentForeground": "#11111B",
    "accentOrange": "#CBA6F7",
    "accentOrangeMid": "#B4BEFE",
    "accentOrangeDeep": "#F5C2E7",
    "accentBurntOrange": "#EBA0AC",
    "accentYellowSoft": "#F9E2AF",

    "hover": "#45475A",
    "pressed": "#313244",
    "disabled": "#6C7086",
    "focus": "#B4BEFE",

    "glassOverlay": "#CDD6F40D",
    "glassStrong": "#CDD6F426",
    "overlayDark": "#11111B4D",
    "overlayLight": "#CDD6F40F",
    "overlayOrange": "#CBA6F74D",
    "scrim": "#11111B80"
  }
}
