{
  "$schema": "https://logos.co/schemas/basecamp-theme/1.json",
  "formatVersion": 1,
  "id": "logos.dark",
  "name": "Logos Dark",
  "author": "Logos",
  "mode": "dark",
  "palette": {
    "background": "#171717",
    "backgroundSecondary": "#262626",
    "backgroundTertiary": "#1C1C1C",
    "backgroundElevated": "#0E121B",
    "backgroundMuted": "#80808012",
    "backgroundBlack": "#000000",
    "backgroundInset": "#141414",
    "backgroundButton": "#2F2F2F",
    "surface": "#343434",
    "surfaceRaised": "#232323",
    "surfaceInteractiveHover": "#434343",
    "surfaceRecessed": "#1F1F1F",
    "surfaceContrast": "#595959",
    "text": "#FFFFFF",
    "textSecondary": "#A4A4A4",
    "textSubtle": "#A9A9A9",
    "textTertiary": "#969696",
    "textPlaceholder": "#717784",
    "textMuted": "#5C5C5C",
    "border": "#434343",
    "borderSecondary": "#2B303B",
    "borderTertiary": "#969696",
    "borderTertiaryMuted": "#96969633",
    "borderSubtle": "#333333",
    "borderHairline": "#80808033",
    "borderGlyph": "#96969659",
    "borderInteractive": "#434343",
    "borderDark": "#2F2F2F",
    "borderStrong": "#515151",
    "primary": "#ED7B58",
    "primaryHover": "#F55702",
    "primaryPressed": "#8F3C03",
    "primarySoft": "#FFD5C0",
    "primaryForeground": "#FFFFFF",
    "success": "#49F563",
    "successHover": "#6CCC93",
    "successPressed": "#19C332",
    "successBorder": "#49F56366",
    "error": "#FB3748",
    "errorHover": "#FF736A",
    "errorPressed": "#F44336",
    "errorBorder": "#FB374866",
    "warning": "#FEBC2E",
    "warningHover": "#FFA726",
    "warningBorder": "#FEBC2E66",
    "info": "#4A90E2",
    "primaryBorder": "#ED7B5866",
    "notification": "#FB3748",
    "brandMark": "#FFFFFF",
    "accentForeground": "#000000",
    "accentOrange": "#ED7B58",
    "accentOrangeMid": "#FF6F42",
    "accentOrangeDeep": "#FF4911",
    "accentBurntOrange": "#BF5104",
    "accentYellowSoft": "#EEF083",
    "hover": "#5C5C5C",
    "pressed": "#262626",
    "disabled": "#969696",
    "focus": "#FF8800",
    "glassOverlay": "#80808012",
    "glassStrong": "#8080804C",
    "overlayDark": "#1C1C1C4C",
    "overlayLight": "#FFFFFF0F",
    "overlayOrange": "#FF88004C",
    "scrim": "#00000080"
  },
  "spacing": {
    "tiny": 4,
    "small": 8,
    "medium": 12,
    "large": 16,
    "xlarge": 20,
    "xxlarge": 40
  },
  "radius": {
    "tiny": 2,
    "small": 4,
    "medium": 6,
    "large": 8,
    "xlarge": 16,
    "pill": 999
  },
  "typography": {
    "sizes": {
      "mainTitleText": 256,
      "pageTitleText": 36,
      "titleText": 30,
      "panelTitleText": 24,
      "subtitleText": 16,
      "primaryText": 14,
      "secondaryText": 12,
      "badgeText": 8
    },
    "weights": {
      "regular": 400,
      "medium": 500,
      "bold": 700
    }
  }
}