{
  "$schema": "https://logos.co/schemas/basecamp-theme/1.json",
  "formatVersion": 1,
  "id": "alisher.hacker",
  "name": "Hacker",
  "author": "Alisher",
  "mode": "dark",
  "palette": {
    "background": "#050805",
    "backgroundSecondary": "#0A120A",
    "backgroundTertiary": "#081008",
    "backgroundElevated": "#0C160C",
    "backgroundMuted": "#00FF4110",
    "backgroundBlack": "#000000",
    "backgroundInset": "#020402",
    "backgroundButton": "#0F1F0F",
    "surface": "#0D1A0D",
    "surfaceRaised": "#0A140A",
    "surfaceInteractiveHover": "#143014",
    "surfaceRecessed": "#050A05",
    "surfaceContrast": "#1E3D1E",
    "text": "#00FF41",
    "textSecondary": "#00C832",
    "textSubtle": "#00B82E",
    "textTertiary": "#00A028",
    "textPlaceholder": "#0A8A2A",
    "textMuted": "#2E6B3A",
    "border": "#1F5A2A",
    "borderSecondary": "#123A18",
    "borderTertiary": "#2E8B3E",
    "borderSubtle": "#0F2E14",
    "borderHairline": "#00FF411F",
    "borderGlyph": "#00FF4140",
    "borderInteractive": "#1F5A2A",
    "borderDark": "#0F2E14",
    "borderStrong": "#3FAF52",
    "primary": "#00FF41",
    "primaryHover": "#5CFF7F",
    "primaryPressed": "#00C832",
    "primarySoft": "#00FF4126",
    "primaryForeground": "#000000",
    "success": "#39FF14",
    "successHover": "#6BFF4D",
    "successPressed": "#2BC010",
    "successBorder": "#39FF1466",
    "error": "#FF3B3B",
    "errorHover": "#FF6B6B",
    "errorPressed": "#CC2E2E",
    "errorBorder": "#FF3B3B66",
    "warning": "#FFD300",
    "warningHover": "#FFE04D",
    "warningBorder": "#FFD30066",
    "info": "#00E5FF",
    "notification": "#FF3B3B",
    "brandMark": "#00FF41",
    "accentForeground": "#000000",
    "accentOrange": "#00FF41",
    "accentOrangeMid": "#5CFF7F",
    "accentOrangeDeep": "#00C832",
    "accentBurntOrange": "#008F24",
    "accentYellowSoft": "#CCFF66",
    "hover": "#143014",
    "pressed": "#0A200A",
    "disabled": "#2E6B3A",
    "focus": "#5CFF7F",
    "glassOverlay": "#00FF410A",
    "glassStrong": "#00FF411F",
    "overlayDark": "#0000004D",
    "overlayLight": "#00FF410F",
    "overlayOrange": "#00FF414D",
    "scrim": "#000000B3"
  },
  "radius": {
    "scale": 0
  },
  "typography": {
    "family": [
      "JetBrains Mono",
      "JetBrainsMono Nerd Font",
      "JetBrainsMono NF"
    ],
    "monoFamily": [
      "JetBrains Mono",
      "JetBrainsMono Nerd Font",
      "JetBrainsMono NF"
    ]
  }
}
